{
  "$schema": "https://agentrig.ai/schema/agentrig-review.json",
  "review_status": "approved",
  "reviewer": "AgentRig Registry Fixture",
  "reviewed_at": "2026-04-26T07:30:00Z",
  "scanner_summary": {
    "status": "pass",
    "findings": []
  },
  "policy_decisions": [
    "Standalone MCP fixture used to verify the registry can publish MCP servers without bundling them inside a plugin."
  ],
  "trust_tier_basis": {
    "trust_tier": "reviewed",
    "installability": "installable",
    "rationale": "Fixture maintained by the registry team to verify standalone MCP ingestion."
  }
}
