{
  "$schema": "https://agentrig.ai/schema/agentrig-review.json",
  "review_status": "pending",
  "reviewer": "AgentRig Community Intake",
  "reviewed_at": "2026-04-14T15:00:00Z",
  "scanner_summary": {
    "status": "warn",
    "findings": [
      "Discovery-only listing pending full review."
    ]
  },
  "policy_decisions": [
    "Visible in discovery only.",
    "Not installable until a reviewed or official decision exists."
  ],
  "trust_tier_basis": {
    "trust_tier": "listed",
    "installability": "discovery_only",
    "rationale": "Submission accepted for discovery, but not yet promoted to an installable tier."
  }
}
