{
  "$schema": "https://agentrig.ai/schema/agentrig-review.json",
  "review_status": "approved",
  "reviewer": "AgentRig Security Review Team",
  "reviewed_at": "2026-04-16T11:00:00Z",
  "scanner_summary": {
    "status": "pass",
    "findings": []
  },
  "policy_decisions": [
    "Security workflow reviewed and approved for official publication."
  ],
  "trust_tier_basis": {
    "trust_tier": "official",
    "installability": "installable",
    "rationale": "Security review completed by AgentRig maintainers."
  }
}
