{
  "$schema": "https://agentrig.ai/schema/agentrig-review.json",
  "review_status": "blocked",
  "reviewer": "AgentRig Security Review Team",
  "reviewed_at": "2026-04-13T13:30:00Z",
  "scanner_summary": {
    "status": "fail",
    "findings": [
      "Blocked by a registry advisory pending upstream remediation."
    ]
  },
  "policy_decisions": [
    "Hard-blocked for new installs.",
    "Retained for auditability and advisory tracking only."
  ],
  "trust_tier_basis": {
    "trust_tier": "blocked",
    "installability": "blocked",
    "rationale": "Blocked due to an unresolved policy and integrity advisory."
  }
}
