{
  "$schema": "https://agentrig.ai/schema/agentrig-review.json",
  "review_status": "approved",
  "reviewer": "AgentRig Community Review Team",
  "reviewed_at": "2026-04-15T18:30:00Z",
  "scanner_summary": {
    "status": "pass",
    "findings": []
  },
  "policy_decisions": [
    "Community plugin passed manual review.",
    "Approved for reviewed-tier installs."
  ],
  "trust_tier_basis": {
    "trust_tier": "reviewed",
    "installability": "installable",
    "rationale": "Community maintained plugin reviewed against the public policy baseline."
  }
}
